{
  "schemaVersion": "1.0.0",
  "fixture": "contradictory-evidence.json",
  "packetId": "ccpa-contradictory-001",
  "packetPurpose": "fixture",
  "reviewStatus": "approved",
  "humanReviewed": true,
  "reviewedBy": null,
  "reviewedDate": null,
  "generatedBy": "EvidenceGate Phase 0 design pass — proposed by the same process that authored the rubric and the fixture",
  "generatedDate": "2026-08-05",
  "syntheticEvidenceNotice": "Every evidence record in packet ccpa-contradictory-001 has origin 'synthetic'. The conflicts below are constructed to exercise the auditor's contradiction handling. The fail on REQ-3 is a fail about an invented packet and says nothing about real proposal volumes in commercial cleaning.",

  "findings": [
    {
      "requirementId": "REQ-1",
      "requirement": "Target-customer specificity",
      "status": "pass",
      "evidenceIds": ["EV-001"],
      "contradictoryEvidenceIds": [],
      "missingEvidence": [
        "In/out decisions from a second rater applied to the same 10 screened companies, to test whether the boundaries are decidable by someone who did not write them."
      ],
      "severity": "none",
      "rationale": "CL-001 commits to four checkable boundaries and three exclusions. EV-001 records the definition applied to 10 companies with a named boundary for each of the 6 exclusions and no undecidable rows, including P-14 sorted out on both headcount and proposal authorship. The definition's usefulness is visible elsewhere in this packet: it is what allows EV-015, the packet's most impressive-looking record, to be set aside as describing a different buyer rather than absorbed into the evidence for other requirements.",
      "impact": "Because the segment is decidable, the conflicts in this packet can be read as genuine disagreement between in-segment sources rather than as an artifact of mixing populations.",
      "recommendation": "Keep the screening sheet as the operative definition of record and record the rater and date per row.",
      "verificationTest": "Give the definition and twelve real companies including four borderline cases to a person who did not write it. Any disagreement with the team's sorting identifies an underspecified boundary and drops this finding to partial.",
      "requiresHumanDecision": false,
      "claimIds": ["CL-001"],
      "subAssessments": {
        "definitionQuality": {
          "verdict": "specific-and-testable",
          "rationale": "Four boundaries and three exclusions, each applicable to a named company without further clarification.",
          "missingDefinitionElements": []
        },
        "evidenceAssessment": {
          "verdict": "sufficient",
          "rationale": "EV-001 records the definition being applied consistently across 10 companies with reasons per exclusion.",
          "independentDirectlyRelevantSources": 1,
          "sourceIds": ["INTERNAL-SCREEN"],
          "gatedByDefinitionFailure": false
        },
        "contradictionAssessment": {
          "verdict": "none-found",
          "rationale": "No record shows the definition producing inconsistent sorting decisions.",
          "conflictType": null
        }
      },
      "offSegmentSignal": null,
      "policyGap": null,
      "reviewNote": null
    },

    {
      "requirementId": "REQ-2",
      "requirement": "Evidence of observed problem behavior",
      "status": "partial",
      "evidenceIds": ["EV-002", "EV-004"],
      "contradictoryEvidenceIds": ["EV-003"],
      "missingEvidence": [
        "Document version history for P-13, the one in-segment source with no measurement, whose own estimate of 'about an hour' (EV-014) is untested against a record.",
        "A record of work performed outside the document — pricing calls, site measurement, drafting in another application — which both version-history measurements exclude by construction and which could account for part of the gap between P-11's estimate and P-11's measurement.",
        "Any record explaining why P-11 edits prior proposals while P-12 starts most from blank, which is the most visible difference between the fast and slow measurements."
      ],
      "severity": "high",
      "rationale": "CL-002 sets a threshold of more than 2 hours of active assembly per proposal. EV-004 measures P-12 above it across most proposals; EV-003 measures P-11 below it across every proposal in its period. EV-002 is P-11's recalled six-to-eight-hour estimate, including a specific dental proposal, and remains as weaker support because no explicit supersession relationship satisfies OPEN-04. EV-003 measures active document editing while EV-002 may include breaks or work outside the document, so source identity and chronology cannot displace the account. The packet therefore contains credible mixed evidence: strong cross-source disagreement plus an unresolved within-source measurement-versus-recall conflict. It remains partial with human review.",
      "impact": "The instance-scoped claim is satisfied for P-12, so the behavior does occur at material cost for at least one owner. But the packet now shows the problem is not uniform across the segment as defined, which means a product justified on time saved would deliver very different value to P-11 and P-12. The segment may be hiding two populations, and the packet contains no evidence about what separates them.",
      "recommendation": "Measure complete active assembly work for P-13 and further in-segment owners, including documented work outside the word processor, and record reuse-versus-blank behavior as a possible explanatory variable. Use the result to qualify the claim if a stable subset emerges; do not assume in advance that the segment definition is invalid.",
      "verificationTest": "Measure complete active assembly time for additional in-segment owners with the same inclusion rules. Credible measurements on both sides of 120 minutes keep this finding partial. It moves toward pass only if support remains and the conflicting evidence is resolved or shown not to address the defined measure; it moves to fail only if supporting evidence disappears or sufficiently scoped evidence directly falsifies the claim.",
      "requiresHumanDecision": true,
      "claimIds": ["CL-002"],
      "subAssessments": {
        "definitionQuality": {
          "verdict": "specific-and-testable",
          "rationale": "The claim names the activity and commits to a measurable threshold, which is exactly why the conflict is legible: both records can be placed relative to it.",
          "missingDefinitionElements": []
        },
        "evidenceAssessment": {
          "verdict": "limited",
          "rationale": "EV-004 provides instrumented support for P-12 and EV-002 provides weaker recalled support for P-11. EV-003 conflicts with P-11's recall and with a uniform reading of the claim. One in-segment source (P-13) has no measurement.",
          "independentDirectlyRelevantSources": 2,
          "sourceIds": ["P-11", "P-12"],
          "gatedByDefinitionFailure": false
        },
        "contradictionAssessment": {
          "verdict": "credible-mixed",
          "rationale": "EV-003 falls below the threshold for P-11 while EV-004 supports it for P-12. EV-002 remains because no explicit qualifying supersession is declared and the records may not measure identical work. Both cross-source and within-source readings are preserved.",
          "conflictType": "measurement-vs-self-report"
        }
      },
      "offSegmentSignal": "EV-015 measures 271 minutes per proposal across 47 proposals — comfortably above the claim's threshold and the packet's largest sample. It is out of segment on headcount and on who produces proposals, so it can neither rescue the claim nor be counted against it. It is worth noting only because it is the record most likely to be reached for when the in-segment measurements disagree.",
      "policyGap": null,
      "reviewNote": null
    },

    {
      "requirementId": "REQ-3",
      "requirement": "Evidence of problem frequency",
      "status": "partial",
      "evidenceIds": ["EV-007"],
      "contradictoryEvidenceIds": ["EV-005", "EV-006", "EV-008"],
      "missingEvidence": [
        "A record of proposals produced outside the exported tools, which is the only route by which the recorded counts could understate true volume — none was supplied by any source, and P-13 stated they use no other method.",
        "A restated CL-003 with a threshold the evidence could plausibly meet, if the team intends to keep a frequency claim at all."
      ],
      "severity": "high",
      "rationale": "CL-003 claims at least two proposals per week sustained over at least eight consecutive weeks. EV-005, EV-006 and EV-008 are three independent instrumented records below that threshold. EV-007 supports the claim only as P-11's generalized estimate of 'a couple a week, usually' with no period attached. EV-005 explicitly records a proposed supersession relationship to EV-007, but `sameApplicableTimeframe` is false because EV-007 states no timeframe; OPEN-04 therefore forbids displacement. Both records remain. The strong measured counterevidence and weaker unresolved support produce partial, not fail, with human review.",
      "impact": "The measured records strongly undermine the claimed cadence, but the packet contains an unresolved same-source account pointing the other way. Treating chronology alone as correction would hide that provenance conflict.",
      "recommendation": "Ask P-11 to identify the period meant by 'a couple a week' or explicitly correct that estimate, and obtain any proposal records outside the CRM. Only then determine whether EV-005 qualifies as an explicit replacement; keep the claim unchanged while resolving that record relationship.",